<?xml version="1.0" encoding="utf-8"?>
<firewall xmlns="http://www.wago.com/security/firewall" xmlns:xsi="http://www.w3.org/2001/XMLSchema-instance" xsi:schemaLocation="http://www.wago.com/security/firewall params.xsd">
  <parameters>
    <interfaces>
      <interface name="X1" rname="br0" ethernet="yes"/>
      <interface name="X2" rname="br1" ethernet="yes"/>
      <interface name="WAN" rname="wwan0" ethernet="yes" ipsec_srv="yes"/>
      <interface name="VPN" rname="wwan0" ethernet="no" ipsec="yes"/>
      <interface name="VPN" rname="tun+" ethernet="no"/>
      <interface name="VPN" rname="tap+" ethernet="yes"/>
    </interfaces>
  </parameters>
</firewall>
