<?xml version="1.0" encoding="utf-8"?>
<firewall xmlns="http://www.wago.com/security/firewall"
          xmlns:xsi="http://www.w3.org/2001/XMLSchema-instance"
          xsi:schemaLocation="http://www.wago.com/security/firewall params.xsd">
    <parameters>
        <interfaces>
            <interface name="br0"  rname="br0"   ethernet="yes" ipsec_srv="no"/>
            <interface name="br1"  rname="br1"   ethernet="yes" ipsec_srv="no"/>
            <interface name="br2"  rname="br2"   ethernet="yes" ipsec_srv="no"/>
            <interface name="br3"  rname="br3"   ethernet="yes" ipsec_srv="no"/>
            <interface name="WAN"  rname="wwan0" ethernet="yes" ipsec_srv="yes"/>
            <interface name="VPN"  rname="wwan0" ethernet="no"  ipsec="yes"/>
            <interface name="VPN"  rname="tun+"  ethernet="no" />
            <interface name="VPN"  rname="tap+"  ethernet="yes"/>
            <interface name="usb0" rname="usb0"  ethernet="yes" ipsec_srv="no"/>
        </interfaces>
    </parameters>

</firewall>
